{
  "topic": "beach-practice",
  "version": 1,
  "trails": [
    {
      "number": 1,
      "name": "Variables Trail"
    },
    {
      "number": 2,
      "name": "Data Types Trail"
    },
    {
      "number": 3,
      "name": "Operators Trail"
    },
    {
      "number": 4,
      "name": "Input / Output Trail"
    },
    {
      "number": 5,
      "name": "Final Beginner Trial"
    }
  ],
  "questions": [
    {
      "id": "beach-practice-01",
      "slug": "name-a-supply-counter",
      "title": "Name a supply counter",
      "topic": "beach-practice",
      "subtopic": "variables",
      "difficulty": "Easy",
      "questionType": "MULTIPLE_CHOICE",
      "description": "The quartermaster needs a whole-number variable named supplies, starting at 6. Which declaration compiles?",
      "examples": [
        {
          "input": "whole-number counter named tents, starting at 2",
          "output": "int tents = 2;"
        }
      ],
      "constraints": [
        "Choose one option.",
        "Assume snippets appear inside a valid Java method with any stated imports. No code is executed."
      ],
      "starterCode": "",
      "expectedAnswer": "b",
      "options": [
        {
          "id": "a",
          "text": "supplies int = 6;"
        },
        {
          "id": "b",
          "text": "int supplies = 6;"
        },
        {
          "id": "c",
          "text": "int supplies == 6;"
        }
      ],
      "hints": [
        "Java places the type before the variable name."
      ],
      "explanation": "int supplies = 6; declares an int, names it supplies, and initializes it to six.",
      "xpReward": 10,
      "isClassic": false,
      "tags": [
        "variables",
        "multiple_choice",
        "fundamentals"
      ],
      "trail": 1,
      "order": 1,
      "validator": "OPTION"
    },
    {
      "id": "beach-practice-02",
      "slug": "replace-the-lantern-count",
      "title": "Replace the lantern count",
      "topic": "beach-practice",
      "subtopic": "variables",
      "difficulty": "Easy",
      "questionType": "PREDICT_OUTPUT",
      "description": "An assignment replaces the value stored in a variable. What is printed?",
      "examples": [
        {
          "input": "int x = 2; x = 5; println(x);",
          "output": "5"
        }
      ],
      "constraints": [
        "Predict the fixed scenario exactly; use a space between values on the same line and a newline between printed lines.",
        "Assume snippets appear inside a valid Java method with any stated imports. No code is executed."
      ],
      "starterCode": "int lanterns = 4;\nlanterns = 11;\nSystem.out.println(lanterns);",
      "expectedAnswer": "11",
      "options": [],
      "hints": [
        "Read assignments from top to bottom."
      ],
      "explanation": "The second assignment overwrites 4 with 11; the variable does not remember a history of values.",
      "xpReward": 10,
      "isClassic": false,
      "tags": [
        "variables",
        "predict_output",
        "fundamentals"
      ],
      "trail": 1,
      "order": 2,
      "validator": "OUTPUT"
    },
    {
      "id": "beach-practice-03",
      "slug": "choose-a-legal-identifier",
      "title": "Choose a legal identifier",
      "topic": "beach-practice",
      "subtopic": "variables",
      "difficulty": "Easy",
      "questionType": "MULTIPLE_CHOICE",
      "description": "Which name can be used as a Java local variable?",
      "examples": [
        {
          "input": "A descriptive legal name for a boat count",
          "output": "boatCount"
        }
      ],
      "constraints": [
        "Choose one option.",
        "Assume snippets appear inside a valid Java method with any stated imports. No code is executed."
      ],
      "starterCode": "",
      "expectedAnswer": "c",
      "options": [
        {
          "id": "a",
          "text": "2camps"
        },
        {
          "id": "b",
          "text": "camp-count"
        },
        {
          "id": "c",
          "text": "campCount"
        },
        {
          "id": "d",
          "text": "class"
        }
      ],
      "hints": [
        "An identifier cannot start with a digit, contain a hyphen, or be a keyword."
      ],
      "explanation": "campCount begins with a letter and contains only valid identifier characters. The other choices violate Java naming rules.",
      "xpReward": 10,
      "isClassic": false,
      "tags": [
        "variables",
        "multiple_choice",
        "fundamentals"
      ],
      "trail": 1,
      "order": 3,
      "validator": "OPTION"
    },
    {
      "id": "beach-practice-04",
      "slug": "fill-the-assignment-gap",
      "title": "Fill the assignment gap",
      "topic": "beach-practice",
      "subtopic": "variables",
      "difficulty": "Easy",
      "questionType": "CODE_BLANK",
      "description": "Store 9 in an already declared variable. Fill the blank with the assignment operator.",
      "examples": [
        {
          "input": "int fuel; fuel ____ 3;",
          "output": "="
        }
      ],
      "constraints": [
        "Submit only the missing token, preserving Java capitalization.",
        "Assume snippets appear inside a valid Java method with any stated imports. No code is executed."
      ],
      "starterCode": "int rope;\nrope ____ 9;",
      "expectedAnswer": "=",
      "options": [],
      "hints": [
        "Assignment uses one equals sign."
      ],
      "explanation": "The = operator stores the right-hand value in the variable on the left. == compares values instead.",
      "xpReward": 10,
      "isClassic": false,
      "tags": [
        "variables",
        "code_blank",
        "fundamentals"
      ],
      "trail": 1,
      "order": 4,
      "validator": "TOKEN"
    },
    {
      "id": "beach-practice-05",
      "slug": "copies-travel-separately",
      "title": "Copies travel separately",
      "topic": "beach-practice",
      "subtopic": "variables",
      "difficulty": "Medium",
      "questionType": "PREDICT_OUTPUT",
      "description": "Primitive assignment copies a value. Print both counters in the order shown.",
      "examples": [
        {
          "input": "int a=2; int b=a; a=7; print(b+\" \"+a);",
          "output": "2 7"
        }
      ],
      "constraints": [
        "Predict the fixed scenario exactly; use a space between values on the same line and a newline between printed lines.",
        "Assume snippets appear inside a valid Java method with any stated imports. No code is executed."
      ],
      "starterCode": "int crates = 9;\nint backup = crates;\ncrates = 4;\nSystem.out.println(backup + \" \" + crates);",
      "expectedAnswer": "9 4",
      "options": [],
      "hints": [
        "Changing crates later does not change backup."
      ],
      "explanation": "backup received the value 9. Reassigning crates changes only crates, so the output is 9 4.",
      "xpReward": 20,
      "isClassic": false,
      "tags": [
        "variables",
        "predict_output",
        "fundamentals"
      ],
      "trail": 1,
      "order": 5,
      "validator": "OUTPUT"
    },
    {
      "id": "beach-practice-06",
      "slug": "add-to-existing-supplies",
      "title": "Add to existing supplies",
      "topic": "beach-practice",
      "subtopic": "variables",
      "difficulty": "Medium",
      "questionType": "PREDICT_OUTPUT",
      "description": "Trace the compound assignment before the later reassignment.",
      "examples": [
        {
          "input": "int n=3; n+=4; n=n-1; print(n);",
          "output": "6"
        }
      ],
      "constraints": [
        "Predict the fixed scenario exactly; use a space between values on the same line and a newline between printed lines.",
        "Assume snippets appear inside a valid Java method with any stated imports. No code is executed."
      ],
      "starterCode": "int supplies = 8;\nsupplies += 12;\nsupplies = supplies - 3;\nSystem.out.println(supplies);",
      "expectedAnswer": "17",
      "options": [],
      "hints": [
        "+= adds to the existing value."
      ],
      "explanation": "8 plus 12 becomes 20, then subtracting 3 leaves 17.",
      "xpReward": 20,
      "isClassic": false,
      "tags": [
        "variables",
        "predict_output",
        "fundamentals"
      ],
      "trail": 1,
      "order": 6,
      "validator": "OUTPUT"
    },
    {
      "id": "beach-practice-07",
      "slug": "leave-a-block-safely",
      "title": "Leave a block safely",
      "topic": "beach-practice",
      "subtopic": "variables",
      "difficulty": "Medium",
      "questionType": "MULTIPLE_CHOICE",
      "description": "A scout declares a local variable inside a block. What happens at the final line?",
      "examples": [
        {
          "input": "{ int x=1; } print(x);",
          "output": "Compilation fails: x is out of scope."
        }
      ],
      "constraints": [
        "Choose one option.",
        "Assume snippets appear inside a valid Java method with any stated imports. No code is executed."
      ],
      "starterCode": "{ int signal = 5; }\nSystem.out.println(signal);",
      "expectedAnswer": "a",
      "options": [
        {
          "id": "a",
          "text": "Compilation fails because signal is out of scope"
        },
        {
          "id": "b",
          "text": "It prints 5"
        },
        {
          "id": "c",
          "text": "It prints 0"
        }
      ],
      "hints": [
        "A local variable exists only within its declaring block."
      ],
      "explanation": "signal is out of scope after the closing brace. Compilation fails; this is not a runtime default-value issue.",
      "xpReward": 20,
      "isClassic": false,
      "tags": [
        "variables",
        "multiple_choice",
        "fundamentals"
      ],
      "trail": 1,
      "order": 7,
      "validator": "OPTION"
    },
    {
      "id": "beach-practice-08",